{
  "schema_version": "1.0",
  "slug": "internet-court-altllm-portal-cli",
  "producer": {
    "audit_command_version": "1.2.0",
    "commit": "1959cccba59d9413bc5a2813dc3e1641fcf7f1e9",
    "package_version": "0.0.5",
    "repository": "aiskillstore/skillstore"
  },
  "invocation": {
    "id": "5a50226b-24c6-4a41-8bf3-662ff6422f4f",
    "started_at": "2026-07-10T13:12:09.443Z",
    "completed_at": "2026-07-10T14:28:55.273Z",
    "cwd": "/Users/lukin/Projects/skillstore-pr2403-postmerge-hotfix",
    "command": [
      "/Users/lukin/.nvm/versions/node/v22.22.1/bin/node",
      "--import",
      "tsx",
      "/Users/lukin/Projects/skillstore-pr2403-postmerge-hotfix/src/cli/index.ts",
      "skill",
      "audit",
      "../marketplace-pr2403-postmerge-hotfix/skills/internet-court",
      "--slugs",
      "internet-court-altllm-portal-cli,internet-court-humanode-agentlink,internet-court-internet-court,internet-court-kleros-curate,internet-court-kleros-ipfs-upload,internet-court-lifi,internet-court-lifi-stablecoin-swap,internet-court-near-ai-cloud,internet-court-okx-ai,internet-court-okx-guide,internet-court-privy,internet-court-starknet-defi,internet-court-starknet-identity,internet-court-starknet-js,internet-court-starknet-wallet,internet-court-trustless-agents,internet-court-x402",
      "--model",
      "gpt-5.5:high"
    ],
    "skills_root": "/Users/lukin/Projects/marketplace-pr2403-postmerge-hotfix/skills/internet-court",
    "slugs": [
      "internet-court-altllm-portal-cli",
      "internet-court-humanode-agentlink",
      "internet-court-internet-court",
      "internet-court-kleros-curate",
      "internet-court-kleros-ipfs-upload",
      "internet-court-lifi",
      "internet-court-lifi-stablecoin-swap",
      "internet-court-near-ai-cloud",
      "internet-court-okx-ai",
      "internet-court-okx-guide",
      "internet-court-privy",
      "internet-court-starknet-defi",
      "internet-court-starknet-identity",
      "internet-court-starknet-js",
      "internet-court-starknet-wallet",
      "internet-court-trustless-agents",
      "internet-court-x402"
    ],
    "model": "gpt-5.5:high",
    "stdout_digest": "3f854abd87bd12897589a308e00f7d015ce67624fd97c24e3de98b4796f88b39",
    "stderr_digest": "e3b0c44298fc1c149afbf4c8996fb92427ae41e4649b934ca495991b7852b855"
  },
  "report": {
    "input_digest": "15401944e6f4018b8744600d0bf72ed9969acd85820256c9138909c0b8c47ef0",
    "raw_audit_digest": "89cc93a55def26dffcd04fa8a2c5b83864437ac5abaf03529998d91efd539c90",
    "final_digest": "32b148e19f881edb9365e2e51b4bb3745dc5d8a0d5fc213ccbdf90bc139c85ec"
  },
  "package": {
    "content_hash": "b5f7e70ae812c2f228c643f97da6b28100a3b33710f6b033a90cff6a8cc03133",
    "tree_hash": "03cc69db469d73a412a568e4fcf3ae74027dcd545d69cf1297c35de81c0c26cb"
  }
}
